"N","CPMS","Denominacion_Procedimientos","II_NIVEL","III _NIVEL"
1803,"61684","Cirugía de malformación arteriovenosa intracraneal; infratentorial, simple",N/C,"2676.57"
1769,"61536","Craneotomía con elevación de colgajo óseo para escisión de foco epileptogeno, con electrocorticografia durante la cirugía (incluye la remoción de la plancha de electrodos)",,"429.657592834876"
1770,"61537","Craneotomía con elevación de colgajo óseo para lobectomía, lobulo temporal, sin electrocorticografia durante la cirugía",N/C,"699.52"
1771,"61538",Craneotomía con elevación de colgajo óseo; para lobectomía temporal con electrocorticografía durante la operación quirúrgica,N/C,"811.61"
1772,"61539","Craneotomía con elevación de colgajo óseo para lobectomía, que no sea de lobulo temporal, parcial o total, con electrocorticografía durante la operación quirúrgica",,"426.429592834876"
1773,"61540","Craneotomía con elevación de colgajo óseo para lobectomía, que no sea de lobulo temporal, parcial o total, sin electrocorticografía durante la operación quirúrgica",,"400.105759501543"
1774,"61541",Craneotomía con elevación de colgajo óseo para transección de cuerpo calloso,,"396.877990983025"
1775,"61542",Craneotomía con elevación de colgajo óseo para hemiferectomía total,N/C,"445.55"
1776,"61543",Craneotomía con elevación de colgajo óseo para hemiferectomía parcial o subtotal (funcional),N/C,"423.42"
1777,"61545",Craneotomía con elevación de colgajo óseo para escisión de craniofaringioma,,"360.041370799744"
1778,"61546","Craneotomía para hipofisectomía o Escisión de tumor hipofisario, abordaje intracraneal",N/C,"434.49"
1779,"61548","Hipofisectomía o Escisión de tumor hipofisario, abordaje transnasal o transeptal, no estereotáxico",N/C,"604.81"
1780,"61550",Craniectomía para craniosinostosis; una sola sutura craneal,N/C,"386.83"
1781,"61558",Craniectomía amplia por craniosinostosis de varias suturas craneales (cráneo en hoja de trébol); que no requiera injertos óseos,N/C,"412.36"
1782,"61566",Craneotomía con elevación de colgajo óseo; por amigdalohipocampectomía selectiva,,"390.215759501543"
1783,"61570",Craniectomía o craneotomía; para Escisión de cuerpo extraño de cerebro,N/C,"504.84"
1784,"61571",Craniectomía o craneotomía; con tratamiento de herida penetrante del cerebro,N/C,"396.76"
1785,"61575","Abordaje transoral de base de cráneo, tallo encefálico o médula espinal alta para biopsia, descompresión o Escisión de lesión",N/C,"445.55"
1786,"61592","Abordaje cigomático orbitocraneal a la fosa media (seno cavernoso y arteria carotida, clivus, arteria basilar o ápex petroso) incluyendo osteotomía de cigoma, craneotomía, elevación extra o intradural del lobulo temporal",,"375.170038392336"
1787,"61595","Abordaje transtemporal a la fosa posterior, foramen yugular o línea media de base del cráneo, incluyendo mástoidectomía, descompresión del seno sigmoide y/o del nervio facial, con o sin movilización",,"375.170038392336"
1788,"61600","Resección o escisión de lesión infecciosa, vascular o neoplásica de la base de la fosa craneal anterior, extradural",,"374.773037466411"
1789,"61607","Resección o escisión de lesión infecciosa, vascular o neoplásica en región paraselar, seno cavernoso, clivus o línea media de base de cráneo; extradural",,"389.970038392336"
1791,"61611","Transección o ligadura, arteria carotida a nivel del canal petroso; sin reparación Registrar por separado adicionalmente al código de procedimiento primario","361.78","361.78"
1792,"61613","Obliteracion de aneurisma carotideo, malformación arteriovenosa o fístula carotida - cavernosa mediante disección dentro del seno cavernoso",,"389.970038392336"
1798,"61640","Dilatación con balón de vaso espasmo intracraneal, percutáneo, primer vaso sanguíneo",N/C,"1088"
1801,"61680","Cirugía de malformación arteriovenosa intracraneal; supratentorial, simple",N/C,"423.42"
1790,"61610","Transección o ligadura, arteria carotida en el seno cavernoso; con reparación mediante anastomosis o injerto (registrar por separado adicionalmente al código de procedimiento primario)",,"389.478763700978"
1793,"61615","Resección o escisión de lesión infecciosa, vascular o neoplásica de base de fosa posterior, foramen yugular, foramen magnum, o nivel de cuerpos vertebrales C1-C3; extradural",,"375.170038392336"
1794,"61619","Corrección secundaria de la dura por escape de LCR, fosa anterior, media o posterior, después de cirugía de base del cráneo; mediante colgajo de pedículo vascularizado regional o local o colgajo miocutáneo (incluyendo músculo occipital, frontal, temporal o galea aponeurotica)",,"389.573037466411"
1795,"61623","Oclusión arterial con balón endovascular en cabeza o cuello (extracraneal/intracraneal) incluyendo la cateterización selectiva del vaso que se ocluirá, con colocación e insuflación del balón, monitoreo neurológico concomitante, y supervisión radiológica e interpretación del examen angiográfico requerido para la oclusión con balón y para excluir injuria vascular post oclusión",N/C,"7632.92"
1796,"61624","Oclusión permanente transcatéter o embolización por via percutáneas (p ej para destrucción de tumor, para conseguir hemostasia, para ocluir a malformación vascular) por cualquier método dentro del sistema nervioso central (intracraneal, medula espinal)",N/C,"355.73"
1797,"61626","Oclusión transcatéter permanente o embolización por via percutánea (p. ej. para destrucción de tumor, para conseguir hemostasia, para ocluir a malformación vascular) por cualquier método, fuera del sistema nervioso central, en la cabeza o cuello (extracraneal, rama braquiocefálica)",N/C,"15842.97"
1799,"61641","Dilatación con balón de vaso espasmo intracraneal percutáneo, cada vaso sanguíneo adicional de una misma familia vascular (registrar por separado adicionalmente al procedimiento primario)",N/C,"1088"
1800,"61642","Dilatación con balón de vaso espasmo intracraneal, percutáneo, cada vaso sanguíneo adicional de una familia vascular diferente (registrar por separado adicionalmente al procedimiento primario)",N/C,"1088"
1804,"61686","Cirugía de malformación arteriovenosa intracraneal; infratentorial, compleja",N/C,"2676.57"
1805,"61690","Cirugía de malformación arteriovenosa intracraneal; en la duramadre, simple",N/C,"2676.57"
1806,"61692","Cirugía de malformación arteriovenosa intracraneal; en la duramadre, compleja",N/C,"2676.57"
1807,"61697","Cirugía de aneurisma arteriovenoso intracraneal, abordaje intracraneal; circulación carotidea",N/C,"2676.57"
1808,"61698","Cirugía de aneurisma arteriovenoso intracraneal, abordaje intracraneal; circulación vertebrobasilar",N/C,"2676.57"
1809,"61700","Cirugía de aneurisma intracraneal simple, abordaje intracraneal; dependiente de circulación carotidea",N/C,"430.8"
1810,"61702","Cirugía de aneurisma intracraneal simple, abordaje intracraneal; dependiente de circulación vertebrobasilar",N/C,"2676.57"
1811,"61703","Cirugía de aneurisma intracraneal, abordaje cervical mediante aplicación de un clip oclusivo a la arteria carotida cervical (tipo Selverstone-Crutchfield)",N/C,"434.49"
1812,"61705",Cirugía de malformación vascular o fístula carotida-cavernosa; mediante oclusión intracraneal y cervical de la arteria carotida,N/C,"434.49"
1813,"61708",Cirugía de malformación vascular o fístula carótida-cavernosa; mediante electrotrombosis intracraneal,N/C,"2676.57"
1814,"61709",Clipaje de aneurisma cerebral unico,N/C,"2676.57"
1815,"61709.01",Clipaje de aneurisma cerebral multiple,N/C,"2676.57"
1816,"61710","Cirugía de malformación vascular o fístula carotida-cavernosa; mediante embolización intraarterial, inyección, o catéter de balón",N/C,"364.86"
1817,"61711","Anastomosis arterial, arterias extracraneal intracraneal (p ej cerebral media/cortical)",N/C,"423.42"
1818,"61712",Reseccion de cavernoma de tronco cerebral,N/C,"2676.57"
1819,"61712.01",Reseccion de cavernoma hemisferico,N/C,"2676.57"
1820,"61720","Producción de lesión mediante método estereotáxico, incluyendo agujeros de taladro y técnicas de localización y grabación, en globo pálido o tálamo en una etapa o varias etapas",N/C,"708.84"
1821,"61750","Biopsia, aspiración o Escisión por estereotaxia para lesiones intracraneales, incluye los agujeros de trepanación",N/C,"234.13"
1822,"61751","Biopsia, aspiración o Escición por estereotaxia para lesiones intracraneales, incluye los agujeros de trepanación; con guía mediante tomografía o resonancia magnética",N/C,"10603.1"
1823,"61850",Agujero(s) de taladro o con trépano helicoidal para implantación de electrodos neuroestimuladores; cortical,N/C,"378.17"
1824,"61860","Craniectomía o craneotomía para implantación de electrodos neuroestimuladores, en corteza cerebral",N/C,"386.83"
1825,"62000","Elevación de fractura de cráneo deprimida; simple, extradural","315.85","316.22"
1826,"62010",Elevación de fractura de cráneo deprimida; con corrección de duramadre y/o debridamiento de cerebro,"371.88","372.42"
1827,"62100","Craneotomía para corrección de escape dural/cerebroespinal de LCR, incluyendo cirugía para rinorrea/ otorrea","396.84","397.4"
1828,"62115",Reducción de craneomegalia (p ej hidrocefalia tratada); que no requiera injertos óseos o craneoplastía,N/C,"454.17"
1829,"62160","Neuroendoscopia, intracraneal, para colocación o reemplazo de catéter ventricular y fijación a sistema de derivación o de drenaje externo (registrar separadamente además del código para el procedimiento primario)",N/C,"454.17"
1830,"62180",Ventriculocisternostomía (operación tipo Torkildsen),N/C,"454.17"
1831,"62190","Creación de derivación; subaracnoideo/subdural-atrial, -auricular, -yugular","315.85","316.22"
1832,"62192","Creación de derivación subaracnoideo/subdural-peritoneal-pleural, otros destinos",N/C,"376.9"
1833,"62200","Ventriculocisternostomía, tercer ventrículo",N/C,"504.84"
1834,"62201",Ventriculocisternostomía tecer ventrículo; método neuroendoscópico estereotáctico,N/C,"1546.78"
1835,"62220","Creación de derivación; ventrículo-atrial, -yugular, -auricular","296.98","297.35"
1836,"62223","Creación de derivación ventrículo-peritoneal, -pleural, otras terminaciones","315.85","316.22"
1837,"62230","Reemplazo o revisión de la derivación del líquido cefalorraquideo, de la válvula obstruida, o del catéter distal en el sistema de derivación","323.59","323.96"
1838,"62270","Punción lumbar, diagnóstica o terapéutica","4.31","5.99"
1839,"62271",Aplicación de toxina botulínica,,"2.72437195767196"
1840,"62274","Aspiración percutánea, quiste de médula espinal o cavidad siringomiélica","368.63","368.7"
1841,"62275","Biopsia de médula espinal, aguja percutánea","20.2","20.28"
1842,"62287","Procedimiento de descompresión, percutánea de núcleo pulposo de disco intervertebral, cualquier método, empleando técnica con uso de aguja para retirar el material discal, bajo guía fluoroscopica u otra forma de visualización indirecta, con el uso de un endoscopio, con discografía y/o inyección(es) epidural(es) en los nive(es) tratado(s), cuando se realice, uno o varios niveles, lumbar",N/C,"378.85"
1844,"62360",Implantación o reemplazo de dispositivo para infusión intratecal o epidural de fármacos; reservorio subcutáneo,"213.43","213.64"
1848,"63031",Laminectomía con discectomía,N/C,"430.76"
1849,"63055","Abordaje transpedicular con descompresión de la médula espinal, cola de caballo y/o raíces neurales (p ej Disco intervertebral herniado), segmento único; torácico","394.49","492.79"
1843,"62350","Implantación, revisión o reposicionamiento de catéter tunelizado intratecal o epidural, para administración de fármacos a largo plazo con un bomba externa o un reservorio implantable/bomba de infusión, sin laminectomia","215.94","216.23"
1845,"63001","Laminectomía con exploración y/o descompresión de médula espinal o cola de caballo, sin facetectomía, foraminotomía o discotomia (p ej estenosis espinal) en uno o dos segmentos vertebrales a nivel cervical","159.14","493.01"
1846,"63017","Laminectomía con exploración y/o descompresión de médula espinal y/o cola de caballo, sin facetectomía, foraminotomía o discotomia (p. ej. Estenosis espinal) en más de dos segmentos vertebrales a nivel lumbar",N/C,"479.07"
1847,"63020","Laminotomía (hemilaminectomia) con descompresión de raíces neurales, incluyendo facetectomía parcial, foraminotomía y/o Escisión de disco intervertebral herniado, en un interespacio a nivel cervical","422.67","423.02"
1850,"63064","Abordaje costovertebral con descompresión de médula espinal o raíces neurales, (p ej disco intervertebral herniado) torácico; segmento único","404.78","405.7"
1851,"63081","Corpectomía vertebral (resección de cuerpo vertebral) parcial o completa, abordaje anterior con descompresión de médula y/o raíces neurales; cervical, segmento único",N/C,"493.22"
1852,"63085","Corpectomía vertebral (resección de cuerpo vertebral) parcial o completa, abordaje transtorácico con descompresión de médula y/o raíces neurales; torácico, segmento único",N/C,"601.79"
1853,"63087","Corpectomía vertebral (resección de cuerpo vertebral) parcial o completa, abordaje toracolumbar combinado con descompresión de médula, cola de caballo o raíces neurales, nivel torácico bajo o lumbar; segmento único",N/C,"493.22"
1854,"63090","Corpectomía vertebral (resección de cuerpo vertebral) parcial o completa, abordaje transperitoneal o retroperitoneal con descompresión de médula, cola de caballo y/o raíces neurales, nivel torácico, lumbar o sacro; segmento único",N/C,"653.05"
1855,"63170","Laminectomía con mielotomía (p ej tipo Bischof o DREZ), cervical, torácico o toracolumbar",N/C,"558.28"
1856,"63172",Laminectomía con drenaje de quiste o cavidad siringomiélica intramedular; hacia el espacio subaracnoideo,N/C,"558.28"
1857,"63185","Laminectomía con rizotomía, uno o dos segmentos",N/C,"502.48"
1858,"63190","Laminectomía con rizotomía, más de dos segmentos",N/C,"502.48"
1859,"63194","Laminectomía con cordotomía, con sección de un haz espinotalámico, en una etapa, a nivel cervical",N/C,"502.48"
1860,"63250",Laminectomía para Escisión u oclusión de malformación arteriovenosa de la médula espinal; cervical,N/C,"609.53"
1861,"63265","Laminectomía para Escisión o evacuación de lesión intraespinal que no sea neoplasia, extradural, a nivel cervical","553.6","554.51"
1862,"63650",Implantación percutanea de terminal de electrodos neuroestimuladores a nivel epidural,"7.5","7.69"
1863,"63655","Laminectomía para implantación de electrodo neuroestimulador; placa/ paleta, epidural","446.72","447.14"
1864,"63660",Revisión o retiro de electrodos espinales,"371.88","372.42"
1865,"63700",Corrección de meningocele menor de 5.0 cm de diámetro,N/C,"550.54"
1866,"63702",Corrección de meningocele mayor de 5.0 cm de diámetro,N/C,"550.54"
1867,"63710","Injerto dural, medular","553.6","554.51"
1868,"63740","Creación de derivación, lumbar, subaracnoidea-peritoneal, -pleural, u otra, que pueda requerir laminectomía","419.56","420.12"
1869,"63741","Creación de derivación lumbar, subaracnoidea-peritoneal, -pleural u otra por vía percutánea, que no requiera laminectomía","358.24","358.39"
1870,"64400",Inyección de agente anestésico en cualquier rama o división del nervio trigémino,"3.69","3.7"
1871,"64472",Inyección de agente anestésico y/o esteroide en articulación facetaria paravertebral o en nervio que inerva la articulación facetaria en cada nivel adicional cervical o torácico Registrar por separado adicionalmente al código del procedimiento primario,,"302.066307986781"
1872,"64476",Inyección de agente anestésico y/o esteroide en articulación facetaria paravertebral o en nervio que inerva la articulación facetaria en cada nivel adicional lumbar o sacro Registrar por separado adicionalmente al código del procedimiento primario,,"302.066307986781"
1873,"64505",Inyección de agente anestésico en ganglio esfenopalatino,"7.5","7.69"
1874,"64550",Aplicación de neuroestimulador de superficie (transcutáneo),"9.18","9.19"
1875,"64600","Destrucción con agente neurolítico del nervio trigémino: ramas supraórbital, infraórbital, mentóniana, o alveolar inferior","9.18","9.19"
1876,"64622",Destrucción con agente neurolítico del nervio que inerva la articulación facetaria en un único nivel lumbar o sacro,,"302.455595023818"
1877,"64626",Destrucción con agente neurolítico del nervio que inerva la articulación facetaria en un único nivel cervical o torácico,,"302.455595023818"
1878,"64627",Destrucción con agente neurolítico del nervio que inerva la articulación facetaria en cada nivel adicional cervical o torácico Registrar por separado adicionalmente al código del procedimiento primario,,"302.455595023818"
1879,"64722",Descompresión; nervios no especificados en el listado (especificar),"350.49","350.63"
1880,"64774","Escisión de neuroma; nervio cutáneo, identificable quirúrgicamente","500.39","500.95"
1881,"64802",Simpatectomía cervical,"452.79","453.21"
1882,"64831","Sutura de nervio digital, mano o pie; un nervio","222.81","223.23"
1883,"64832","Sutura de nervio digital, mano o pie; cada nervio digital adicional (registrar separadamente además del código del procedimiento primario)","222.81","223.23"
1884,"64861",Sutura de plexo braquial,N/C,"598.61"
1885,"64862",Sutura de plexo lumbar,N/C,"598.61"
1886,"64864",Sutura del nervio facial; extracraneal,N/C,"555.6"
1887,"64865",Sutura del nervio facial; infratemporal con o sin injerto,N/C,"555.6"
1888,"64866",Anastomosis facial-espinal accesorio,N/C,"547.86"
1889,"64868",Anastomosis facial-hipogloso,N/C,"547.86"
1890,"64870",Anastomosis facial-frénico,N/C,"547.86"
1891,"64885",Injerto (incluye la obtención del injerto) de nervio en cabeza o cuello hasta 4.0 cm de largo,"550.92","551.84"
1892,"64918",Biopsia de nervio periférico,"20.2","20.28"
1893,"65091",Evisceración de contenidos oculares; sin implante,"228.52","228.67"
1894,"65101",Enucleación del ojo; sin implante,"252.43","252.64"
1895,"65110","Exenteración de la órbita (no incluye injerto cutáneo), extirpación de contenidosoculares solamente",N/C,"401.64"
1896,"65175",Remoción de implante ocular,"365.36","365.44"
1897,"65205",Remoción de cuerpo extraño externo: conjuntival superficial,"34.1","34.12"
1898,"65235",Extirpación de cuerpo extraño intraocular de la cámara anterior o cristalino,N/C,"366.97"
1899,"65260","Remoción de cuerpo extraño del segmento posterior, mediante extracción magnética a través de ruta anterior o posterior",N/C,"382.25"
1900,"65270","Corrección de laceración de conjuntiva con cierre directo, con o sin laceración no perforante de esclerótica","128.1","128.2"
1901,"65275",Reparación de laceración de córnea con o sin extracción de cuerpo extraño,"201.05","201.1"
1902,"65290","Corrección de herida en músculo extraocular, tendón y/o cápsula de Tenon","255.07","255.16"
1903,"65400","Escisión de lesión de córnea (queratectomía, lamelar, parcial), excepto pterigión","378.31","378.38"
1904,"65410",Biopsia de córnea,"77.05","77.24"
1905,"65420",Escisión o transposición de pterigión; sin injerto,"87.57","87.59"
1906,"65426",Escisión o transposición de pterigión; con injerto,"66.19","66.19"
1907,"65430",Raspado diagnóstico de córnea para frotis y/o cultivo,"86.63","86.65"
1908,"65435","Extirpación de epitelio de córnea; con o sin quimiocauterización (abrasión, curetaje)","200.01","200.04"
1909,"65450","Destrucción de lesión de córnea mediante crioterapia, fotocoagulación o termocauterización","214.78","214.83"
1910,"65771",Queratotomía radial,"203.84","203.88"
1911,"65800",Paracentesis de cámara anterior del ojo (procedimiento separado); con remoción de humor acuoso,"97.67","97.79"
1912,"65820",Goniotomía,"377.39","377.42"
1913,"65850",Trabeculotomía ab externo,N/C,"105.27"
1914,"65855","Trabeculoplastía mediante cirugía láser, una o más sesiones (serie de tratamiento definida)",N/C,"111.87"
1915,"65860","Sección de adherencias del segmento anterior, técnica de láser (procedimiento separado)",N/C,"193.02"
1916,"65865","Sección de adherencias del segmento anterior del ojo, técnica Incisiónal (con o sin inyección de aire o líquido) (procedimiento separado); goniosinequias",N/C,"379.96"
1917,"66130","Escisión de lesión, esclerótica","200.88","200.91"
1918,"66170",Fistulización de esclerótoca por glaucoma; trabeculectomía ab externo en ausencia de cirugía previa,N/C,"671.58"
1919,"66172",Fistulización de esclerótica por glaucoma; trabeculectomÍa ab externo con tejido cicatrizal originado por cirugía ocular previa o trauma (incluye inyección de agentes antifibroticos),"377.04","377.07"
1920,"66180","Derivación de humor acuoso a un reservorio extra ocular (p ej Molteno, Schocket, Denver-Krupin)",N/C,"384.42"
1921,"66220",Corrección de estafiloma escleral; sin injerto,"203.49","203.59"
1922,"66500",Iridotomía mediante Incisión con instrumento cortante (procedimiento separado); excepto transfixión,"200.88","200.91"
1923,"66600","Iridectomía, con sección corneoescleral o córneal; para remoción de lesión","200.88","200.91"
1924,"66680","Corrección del iris, cuerpo ciliar (como para iridodiálisis)","203.84","203.88"
1925,"66700",Destrucción del cuerpo ciliar mediante diatermia,"206.19","206.22"
1926,"66711",Destrucción del cuerpo ciliar mediante ciclofotocoagulación transendoscópica,N/C,"642.27"
1927,"66720",Destrucción del cuerpo ciliar mediante crioterapia,N/C,"613.58"
1928,"66761",Iridotomía/iridectomía mediante cirugía láser (p ej para glaucoma) (por sesión),N/C,"211.85"
1929,"66762","Iridoplastía mediante fotocoagulación (una o más sesiones) (p. ej. Para mejorar la visión, para ensanchamiento del ángulo de la cámara anterior)",N/C,"205.08"
1930,"66770",Destrucción de quiste o de lesiones del iris o cuerpo ciliar (procedimiento no excisional),"215.3","215.35"
1931,"66820",Discision (Incisión) de catarata membranosa secundaria (opacidad capsular posterior y/o hialoide anterior); técnica con instrumento cortante (cuchillo de Ziegler o Wheeler),"91.65","91.65"
1932,"66821",Discision (Incisión) de catarata membranosa secundaria (opacidad capsular posterior y/o hialoide anterior) con cirugía láser (p ej Láser YAG) (uno o más estadios),N/C,"206.92"
1934,"66833",Extracción extracapsular con implante de lente intraocular (LIO),N/C,"390.45"
1935,"66850",Extracción de cristalino mediante técnica de facofragmentación (mecánica o ultrasonica) (p ej facoemulsificacion) con aspiración,N/C,"381.47"
1936,"66850.02",Facoemulsion + vitrectomía anterior,N/C,"525.76"
1937,"66982.01",Cuidados posteriores a la cirugía (Catarata),"67.14","67.14"
1939,"66985","Inserción de lente intraocular (implante secundario), no asociada con Extirpación concurrente de catarata",N/C,"380.22"
1933,"66830","Extirpación de catarata membranosa secundaria (opacidad capsular posterior y /o hialoide anterior) con sección corneo-escleral, con o sin iridectomía (iridocapsulotomía, iridocapsulectomía)",N/C,"384.13"
1938,"66984",Extracción extracapsular de catarata con implante de lente intraocular (en una sola etapa) con técnica manual o mecánica (p ej Irrigación y aspiración o facoemulsificacion),N/C,"390.45"
1940,"66986",Intercambio de lente intraocular,N/C,"380.84"
1941,"66993",MININUC con implante de Lente Intra Ocular (LIO),N/C,"477.7"
1942,"67015","Aspiración o Liberación de humor vítreo, fluido subretinal o coroidal, vía pars plana (esclerotomía posterior)",N/C,"197.32"
1943,"67028",Inyección intravítrea de agente farmacologico (procedimiento separado),"87.62","87.65"
1944,"67031","Eliminacion de filamentos, membranas, opacidades, láminas o adhesiones vitreas mediante cirugía láser (en uno o más sesiones)",N/C,"193.36"
1945,"67036","Vitrectomía mecánica, vía pars plana",N/C,"525.76"
1946,"67039","Vitrectomía mecánica, abordaje por pars plana; con fotocoagulación endoláser focálizada",N/C,"525.76"
1947,"67043","Vitrectomía, mecánica, vía pars plana; con retiro de membrana subretinal (p. ej. Neovascularización coroidal), incluye, si se realiza, taponamiento intraocular (p. ej. Aire, gas o aceite de silicona) y fotocoagulación láser",N/C,"2426.84"
1948,"67080","Corrección de desprendimiento de retina, con crioterapia",N/C,"387.51"
1949,"67082","Corrección de desprendimiento de retina con vitrectomía pars plana, sutura de explante de silicona y crioterapia o endoláser",N/C,"525.76"
1950,"67141","Profilaxis de desprendimiento de retina (p ej ruptura retiniana, degeneracion reticular) usando crioterapia o diatermia, sin drenaje, en una o más sesiones",N/C,"260.71"
1951,"67208","Destrucción de lesión locálizada de la retina (p ej Edema macular, tumores) con crioterapia o diatermia, una o más sesiones",N/C,"197.94"
1952,"67220","Destrucción de lesión locálizada de coroides (p ej Neovascularizacion coroidal) mediante fotocoagulación (p ej Láser), una o más sesiones",N/C,"197.94"
1953,"67227","Destrucción de retinopatía extensa o progresiva (p ej Retinopatía diabética) mediante crioterapia, o láser, en una o más sesiones",N/C,"197.94"
1954,"67311","Cirugía para estrabismo, procedimiento de recesion o reseccion; un músculo horizontal","382.44","382.53"
1955,"67312","Cirugía para estrabismo, procedimiento de recesion o reseccion; dos músculos horizontales","389.53","389.53"
1956,"67345",Quimiodesnervación de músculo extra ocular,"117.05","117.09"
1957,"67350",Biopsia de músculo extra ocular,"123.81","124.03"
1958,"67415",Aspiración de contenidos órbitales con aguja fina,"117.23","117.29"
