"N","CPMS","Denominacion_Procedimientos","II_NIVEL","III _NIVEL"
836,"29889","Corrección, aumento, o reconstrucción de ligamento cruzado posterior asistidos por artroscopía","206.76",
837,"30000","Drenaje de absceso o hematoma nasal, abordaje interno","21.35","21.39"
838,"30100",Biopsia intranasal,"21.3","21.42"
839,"30110",Escisión de polipo nasal simple,"78.41","78.59"
840,"30117",Escisión o Destrucción de lesión intranasal a través de abordaje interno,"207.35","207.47"
841,"30120",Escisión o dermoabrasión de piel de la nariz debido a rinofima,"82.15","82.42"
842,"30124","Escisión de quiste dermoide simple de nariz, subcutánea","41.07","42.14"
843,"30130","Escisión de cornete nasal inferior parcial o completa, cualquier método","228.78","229"
844,"30150",Rinectomía parcial,"131.84","132.15"
845,"30160",Rinectomía total,"428.98","429.33"
846,"30200",Inyección terapéutica dentro del cornete nasal,"2.92","2.94"
847,"30300",Extirpación de cuerpo extraño intranasal simple (similar al procedimiento de consultorio externo),"3.16","3.19"
848,"30310",Extirpación de cuerpo extraño intranasal con necesidad de anestesia general,"108.13","109.11"
849,"30400",Rinoplastía primaria con modificacion de los cartílagos alares y laterales y/o elevación de la punta nasal,"128.69","128.93"
850,"30430",Rinoplastía Secundaria con revisión menor (trabajo sobre la punta de la nariz),"130.58","130.86"
851,"30460","Rinoplastía por deFormación nasal secundaria a labio y/o paladar hendidos congénitos, incluyendo alargamiento de columela, solamente la punta","213.65","213.89"
852,"30520","Septoplastía o Resección submucosa del septum nasal, con o sin raspado de cartílago, contorneo o reemplazo con injerto","213.59","213.87"
853,"30540",Corrección de atresia de coana; vía intranasal,"373.44","373.63"
854,"30560",Lisis de sinequia intranasal,"39.28","40.26"
855,"30580","Corrección de fístula oromaxilar u oronasal (combinar con 31030, si es que se incluye antrotomía)","279.64","279.88"
856,"30600",Reparación de fístula oronasal,"275.62","275.84"
857,"30630",Corrección de Perforaciónes del tabique nasal,"126.81","127"
859,"30901",Control de hemorragia nasal con Cauterización y/o taponamiento nasal anterior simple (limitado a Cauterización y/o taponamiento con gasa),"43.6","43.65"
858,"30801","Ablación de tejido blando de cornete nasal inferior, unilateral o bilateral, con cualquier método (p ej Electrocauterio, ablación por radiofrecuencia o reducción de volumen); superficial","43.36","43.4"
860,"30903",Control de hemorragia nasal con Cauterización y/o taponamiento nasal anterior complejo (uso extenso de cauterio y/o taponamiento con gasa),"43.6","43.65"
861,"30905",Control de hemorragia nasal con Cauterización y/o taponamiento nasal posterior usando paquetes de gasa y/o cauterio Procedimiento inicial,"43.84","43.9"
862,"30906",Control de hemorragia nasal con Cauterización y/o taponamiento nasal posterior usando paquetes de gasa y/o cauterio Procedimiento subsecuente,"43.84","43.9"
863,"30930","Fractura de cornetes nasales inferior(es), terapéutica","40.11","40.99"
864,"31000",Lavado del seno maxilar por canulación (Punción del antro u ostium natural),"4.88","5.01"
865,"31020",Sinusotomía maxilar (antrotomía); intranasal,"279.64","279.88"
866,"31030",Sinusotomía maxilar radical (Caldwell-Luc) sin Extirpación de polipos antrocoanales,"290.69","290.92"
867,"31040","Cirugía de la fosa pterigomaxilar, cualquier abordaje",N/C,"384.52"
868,"31050","Sinusotomía esfenoidal, con o sin biopsia",N/C,"384.52"
869,"31070","Sinusotomía frontal; externa, simple (con Trepanación)",N/C,"351.44"
870,"31200","Etmoidectomía; intranasal, anterior",N/C,"363.85"
871,"31225",Maxilectomía sin exenteración órbitaria,N/C,"384.52"
872,"31230",Maxilectomía; con exenteración órbitaria (en bloque),N/C,"401.07"
873,"31231",Endoscopía nasal diagnóstica unilateral o bilateral (procedimiento separado),"49.91","50.16"
874,"31300","Laringotomía (tirotomía, laringofisura); con extirpación de tumor o laringocele y cordectomía",N/C,"351.44"
875,"31360","Laringuectomía total, sin disección radical del cuello",N/C,"378.9"
876,"31365","Laringuectomía total, con disección radical del cuello",N/C,"383.34"
877,"31367","Laringuectomía subtotal supraglotica, sin disección radical del cuello",N/C,"374.46"
878,"31368","Laringuectomía subtotal supraglotica, con disección radical del cuello",N/C,"378.9"
879,"31370",Laringuectomía parcial (hemilaringuectomía); horizontal,N/C,"374.46"
880,"31390","Faringolaringuectomía, con disección radical del cuello; sin rectonstruccion",N/C,"392.23"
881,"31400","Aritenoidectomía o Aritenoidopexia, abordaje externo",N/C,"384.52"
882,"31420",Epiglotidectomía,"375.13","375.35"
883,"31500","Intubación endotraqueal, procedimiento de emergencia, urgencia o electivo","30.76","30.76"
884,"31505","Laringoscopía indirecta, diagnóstica (procedimiento separado)","47.38","47.56"
885,"31515","Laringoscopía directa, con o sin traqueoscopía; para aspiración","49.17","49.44"
886,"31530","Laringoscopía, directa, operatoria, con extirpación de cuerpo extraño","242.93","242.93"
887,"31580","Laringoplastía para membrana laríngea, en dos estadios, con Inserción y Remoción de quilla",N/C,"374.46"
888,"31588","Laringoplastía, sin otra especificacion (p ej por quemaduras, Reconstrucción después de Laringuectomía parcial)",N/C,"374.46"
889,"31590",Reinervacion laríngea por pedículo neuromuscular,N/C,"393.33"
890,"31595","Sección del nervio laríngeo recurrente, terapéutica (procedimiento separado), unilateral","231.64","231.88"
891,"31596","Extirpación de lesiones de cuerdas vocales con microcirugía (nodulo, papilomas)","104.73","104.73"
892,"31603","Traqueostomía, procedimiento de emergencia; transtraqueal","72.43","72.46"
893,"31605",Traqueostomía transtraqueal de emergencia a través de membrana de cartílago cricotiroideo,"2.86","2.86"
894,"31612",Punción traqueal percutánea con aspiración y/o Inyección transtraqueal,"15.68","15.84"
895,"31613",Revisión de traqueostomía simple sin rotación de Flap,"9.57","9.59"
896,"31620",Ecografía endobronquial (EBUS) durante una intervencion diagnóstica o terapéutica con broncoscopio Registrar por separado adicionalmente al código del procedimiento primario,N/C,"5.59"
897,"31622","Broncoscopía, rígida o flexible, incluye la guía fluoroscopica, cuando se realice, con lavado de células, cuando se realice (procedimiento separado)","162.04","162.21"
898,"31623","Broncoscopía, rígida o flexible, incluye guía fluoroscópica, cuando se realice, con cepillado simple o protegido","209.87","209.87"
899,"31624","Broncoscopía, rígida o flexible, incluye guía fluoroscopica, cuando se realice, con lavado bronquioalveolar","244.05","244.12"
900,"31629","Broncoscopía, rígida o flexible, incluyendo guía fluoroscópica, cuando se realice, con biopsia(s) transbronquial(es) de aspiración con aguja, traquea, bronquio principal y/o bronquio lobar","32.35",
901,"31635","Broncoscopía, incluyendo guia fluoroscópica, cuando se realice, y remoción de cuerpo extraño","209.87","209.87"
902,"31640","Broncoscopia, incluyendo guia fluoroscopica, cuando se realice; con escicion de tumor",N/C,"192.33"
903,"31645","Broncoscopía, incluyendo guía fluoroscopica, cuando se realice, con aspiración terapéutica del arbol bronquial (pej: drenaje de absceso pulmonar), procedimiento inicial","254.7","254.79"
904,"31660","Broncoscopia, rigida o flexible, incluyendo guia fluoroscopica, cuando se realiza; con termoplastia bronquial, un lobulo",N/C,"181.3"
905,"31720.01",Aspiración de secreciones,"16.4","16.4"
906,"31720.02",Aspiración de secreciónes por circuito cerrado o continua,,"10.1667380952381"
907,"31750","Traqueoplastía, cervical",N/C,"295.12"
908,"31766",Reconstrucción de carina traqueal,"392.31","392.87"
909,"31770",Broncoplastía; Reparación con injerto,"392.31","392.87"
910,"31785",Escisión de tumor o carcinoma traqueal: nivel cervical,N/C,"500.31"
911,"31800","Sutura de herida o lesión traqueal, nivel cervical","273.49","273.64"
912,"31820",Cierre quirúrgico de traqueostomía o fístula; sin plastia,N/C,"269.05"
913,"31820.01",Curación de traqueostomía,N/C,"24.82"
914,"31825",Cierre quirúrgico de traqueostomía o fístula; con plastia,N/C,"269.05"
915,"31830",Revisión de cicatriz de traqueostomía,"205.97","206.08"
916,"32005",Pleurodesis,"30.8","30.84"
917,"32035","Toracostomía, ventana torácica (con Resección de costilla) para drenaje de empiema","30.8","30.84"
918,"32095","Toracotomía, limitada, para biopsia pulmonar o pleural","75.4","77.8"
919,"32100","Toracotomia, con exploracion",N/C,"195.04"
920,"32200",Neumonostomía con drenaje abierto de absceso o quiste,N/C,"385.86"
921,"32201",Neumonostomía; con drenaje percutáneo de absceso o quiste,"385.44","385.86"
922,"32220",Decorticacion pulmonar total (procedimiento separado),"392.31","392.87"
923,"32225",Decorticacion pulmonar parcial (procedimiento separado),"385.44","385.86"
924,"32310",Pleurectomía parietal (procedimiento separado),"452.79","453.21"
925,"32320",Decorticacion y pleurectomía parietal,"492.65","493.21"
926,"32400","Biopsia, pleura; aguja percutánea","21.3","21.42"
927,"32405","Biopsia, pulmon o mediastino, aguja percutánea","42.58","43.84"
928,"32420",Pneumonocentesis; Punción de pulmon para aspiración,"53.98","56.74"
929,"32421","Toracocentesis, para aspiración, primera vez o subsecuente",N/C,"30.16"
930,"32422","Drenaje toracico con tubo de drenaje, incluye sistema de sello bajo agua (p. ej. neumotorax)",N/C,"191.84"
931,"32440",Neumonectomía total,N/C,"383.34"
932,"32442",Neumonectomía total con Resección de segmento de tráquea seguido de anastomosis broncotraqueal,N/C,"410"
933,"32480",Lobectomía pulmonar,N/C,"385.86"
934,"32482",Bilobectomía pulmonar,"385.44","385.86"
935,"32484",Segmentectomía pulmonar,"392.31","392.87"
936,"32540",Enucleación extrapleural de empiema (empiemectomía),"397.44","397.72"
937,"32551","Toracostomía con tubo, incluye conexión a sistema de drenaje (p ej sello de agua), cuando se realice abierto (procedimiento separado)","30.8","30.84"
938,"32554","Toracocentesis, con aguja o catéter, aspiración del espacio pleural; sin guía de imágenes","466.5","466.5"
939,"32555","Toracocentesis, con aguja o catéter, aspiración del espacio pleural; con guía de imágenes","466.5","466.5"
940,"32601","Toracoscopia diagnóstica de pulmones, saco pericárdico, mediastino o espacio pleural, sin biopsia (procedimiento separado)","77.97","78.54"
941,"32608","Toracoscopia, con biopsia(s) diagnostica(s) de nodulo(s) o masa(s) pulmonar(es) (p. ej. cuña, incisional) unilateral",N/C,"193.82"
942,"32650","Toracoscopia quirúrgica, con pleurodesis (p ej Mecánica o química)","161.63","162.52"
943,"32662.01",Escision de tumor mediastinico por toracoscopia con asistencia robotica,,"140.318273682668"
944,"32663",Lobectomia (lobulo unico) por toracoscopia,N/C,"194.43"
945,"32663.01",Lobectomia pulmonar por toracoscopia con asistencia robotica,,"140.318273682668"
946,"32669.01",Segmentectomia pulmonar por toracoscopia con asistencia robotica,,"140.318273682668"
947,"32670","Toracoscopia quirurgica, con retiro de dos lobulos (bilobectomia)",N/C,"194.43"
948,"32670.01",Bilobectomia pulmonar por toracoscopia con asistencia robotica,,"137.912047987457"
949,"32671","Toracoscopia quirurgica, con remocion pulmonar (neumonectomia)",N/C,"194.43"
950,"32674.01",Linfadenectomia intratoracica mediastinal y regional por toracoscopia con asistencia robotica,,"140.318273682668"
951,"32800",Cura quirúrgica de hernia pulmonar a través de la pared torácica,"349.83","349.98"
952,"32815",Cierre abierto de fístula bronquial mayor,N/C,"383.34"
953,"32820",Reconstrucción mayor de pared torácica (postraumática),"397.44","397.72"
954,"32900","Resección de costillas, extrapleural, todos los niveles","349.83","349.98"
955,"32905","Toracoplastía, tipo Schede o extrapleural (todos los niveles)","397.44","397.72"
956,"32960","Inyección intrapleural de aire, Neumotorax terapéutico","30.38","30.41"
957,"33010",Pericardiocentesis inicial,"30.62","30.66"
958,"33015",Pericardiostomía de tubo,"275.31","275.5"
959,"33020",Pericardiotomía para Extirpación de coágulo o cuerpo extraño (procedimiento primario),"299.45","299.73"
960,"33025",Creación de ventana pericárdica o Resección parcial para drenaje por via transtorácica,N/C,"291.99"
961,"33030","Pericardiectomía parcial o completa, sin circulación extracorporea","323.59","323.96"
962,"33050",Escisión de quiste o tumor pericárdico,"445.05","445.47"
963,"33120","Escisión de tumor intracardíaco, resección con derivación cardiopulmonar",N/C,"493.47"
964,"33130",Resección de tumor cardíaco externo,"381.35","382.08"
965,"33206",Inserción de marcapaso permanente nuevo o de reemplazo con electrodo(s) transvenoso(s) a nivel auricular,"207.49","207.54"
966,"33207",Inserción de marcapaso permanente nuevo o de reemplazo con electrodo(s) transvenoso(s) a nivel ventricular,"207.49","207.54"
967,"33208",Inserción de marcapaso permanente nuevo o de reemplazo con electrodo(s) transvenoso(s) a nivel auricular y ventricular,"207.49","207.54"
968,"33210",Inserción o reemplazo de electrodo o catéter marcapasos cardiaco transvenoso temporal de cámara única (procedimiento separado),"207.49","207.54"
969,"33250","Ablación quirúrgica de foco o vía, tracto(s) (ej síndrome de Wolff-Parkinson-White, reentrada de un nodo A-V) y/o foco(s) arritmogénicos supraventricular(es); sin derivación cardiopulmonar","240.6","240.81"
970,"33300",Corrección de lesión cardíaca; sin derivación cardiopulmonar,"384.3","384.69"
971,"33305",Corrección de lesión cardíaca; con derivación cardiopulmonar,N/C,"548.97"
972,"33310","Cardiotomía exploradora via transtorácica (incluye Extirpación de cuerpo extraño, trombos instracoronarios auriculares o ventriculares); sin derivación cardiopulmonar","397.44","397.72"
973,"33320","Reparación de la aorta o grandes vasos, sin shunt ni derivación cardio-pulmonar",N/C,"493.47"
974,"33322","Reparación de la aorta o grandes vasos, con derivación cardio-pulmonar",N/C,"565.96"
975,"33330","Colocación de injerto en la aorta o grandes vasos, sin shunt ni derivación cardio-pulmonar",N/C,"397.67"
976,"33400","Valvuloplastía, válvula aortica; abierta, con derivación cardiopulmonar","393.07","393.07"
977,"33404",Construcción de un conducto apical aórtico,N/C,"498.01"
978,"33405","Reemplazo de válvula aortica, con derivación cardiopulmonar; con válvula protésica que no sea homoinjerto o válvula sin soporte","481.19","481.19"
979,"33414",Corrección de obstrucción de la vía de flujo de salida de ventrículo izquierdo mediante alargamiento de tracto de salida con parche,N/C,"548.97"
980,"33415",Resección o Incisión de tejido subvalvular por estenosis aortica subvalvular discreta,N/C,"548.97"
981,"33416",Ventriculomiotomía (-miectomía) por estenosis subaortica hipertrofica idiopática (p ej Hipetrofia septal asimétrica),N/C,"543.3"
982,"33417",Aortoplastía (placa) por estenosis supravalvular,N/C,"543.3"
983,"33420","Valvulotomía, válvula mitral; a corazon cerrado",N/C,"393.33"
984,"33422","Valvulotomía mitral a corazon abierto, con derivación cardiopulmonar",N/C,"443.64"
985,"33425","Valvuloplastía, válvula mitral, con derivación cardiopulmonar","304.95","304.95"
986,"33430","Reemplazo, válvula mitral, con derivación cardiopulmonar","393.07","393.07"
987,"33460","Valvectomía, válvula tricúspide, con derivación cardiopulmonar","304.95","304.95"
988,"33463","Valvuloplastía, válvula tricúspide; sin Inserción de anillo","304.95","304.95"
989,"33465","Reemplazo de válvula tricúspide, con derivación cardiopulmonar","393.07","393.07"
990,"33468",Reposicionamiento y pliegue de la válvula tricúspide por enfermedad de Ebstein,"393.07","393.07"
991,"33470","Valvulotomía, válvula pulmonar, a corazon cerrado; transventricular","153.35","153.35"
992,"33474","Valvulotomía, válvula pulmonar, a corazon abierto; con derivación cardiopulmonar","304.95","304.95"
993,"33475","Reemplazo, válvula pulmonar","304.95","304.95"
994,"33478","Aumento de la vía de flujo de salida (placa), con o sin comisurotomía o Resección infundibular",N/C,"443.64"
995,"33500",Corrección de fístula arteriovenosa coronaria o de fístula de arteria con cámara cardíaca; con derivación cardiopulmonar,N/C,"443.64"
996,"33502",Corrección de arteria coronaria anomala que nace de la arteria pulmonar mediante ligadura,N/C,"384.04"
997,"33504","Corrección de arteria coronaria anomala que nace de la arteria pulmonar mediante injerto, con derivación cardiopulmonar",N/C,"493.47"
998,"33510",Derivación de arteria coronaria usando un injerto venoso coronario,N/C,"384.04"
999,"33511",Derivación de arteria coronaria usando 2 injertos venosos coronarios,N/C,"384.04"
1000,"33512",Derivación de arteria coronaria usando 3 injertos venosos coronarios,N/C,"384.04"
1001,"33513",Derivación de arteria coronaria usando 4 injertos venosos coronarios,N/C,"407.9"
1002,"33514",Derivación de arteria coronaria usando 5 injertos venosos coronarios,N/C,"407.9"
1003,"33516",Derivación de arteria coronaria usando 6 o más injertos venosos coronarios,N/C,"407.9"
1004,"33542",Resección miocárdica (pej: aneurismectomia ventricular),N/C,"599.94"
1005,"33545","Corrección de defecto del tabique ventricular post-infarto, con o sin Resección miocárdica",N/C,"599.94"
1006,"33572","Endarterectomía coronaria, abierta, por cualquier método, de descendene anterior izquierda, circunfleja, o arteria coronaria derecha, que se realiza conjuntamente con procedimiento de derivación de arteria coronaria, cada vaso (registrar separadamente además del código del procedimiento primario)",N/C,"443.64"
1007,"33600",Cierre de válvula auriculoventricular (mitral o tricúspide) mediante sutura o parche,N/C,"501.21"
1008,"33641","Corrección de defecto del tabique auricular, tipo secundum, con o sin parche, con derivación cardiopulmonar",N/C,"443.64"
1009,"33735",Septectomía o Septostomía Auricular a corazon cerrado (procedimiento de Blalock-Hanlon),N/C,"374.94"
1010,"33736",Septectomía o Septostomía Auricular a corazon abierto con derivación cardiopulmonar,N/C,"384.04"
1011,"33750",Cortocircuito de arteria subclavia a arteria pulmonar (Operación de Blalock-Taussig),N/C,"443.64"
1012,"33786",Corrección total del tronco arterioso (Operación de Rastelli),N/C,"501.21"
1013,"33788",Reimplantación de arteria pulmonar anomala,N/C,"493.47"
1014,"33924","Ligadura y desmontado de cortocircuito sistémico hacia la arteria pulmonar, realizado conjuntamente con cirugía correctiva de defecto congénito cardíaco (registrar separadamente además del código de procedimiento primario)",N/C,"493.47"
1015,"33977","Remoción de dispositivo de asistencia ventricular mecánica extracorporeo, un solo ventrículo",N/C,"401.55"
1016,"34001","Embolectomía o trombectomía, con o sin catéter; de la arteria subclavia o arteria innominada, mediante Incisión en el cuello",N/C,"268.46"
1017,"34151","Embolectomía o trombectomía, con o sin catéter, de la arteria renal, celíaca, mesentérica, aortoilíaca, mediante Incisión abdominal",N/C,"374.46"
1018,"34401","Trombectomía, directa o con catéter, de las venas cava o iliaca mediante Incisión abdominal",N/C,"259.39"
1019,"34501",Valvuloplastía de vena femoral,N/C,"277.84"
1020,"34502","Reconstrucción de vena cava, cualquier método",N/C,"393.81"
1021,"34510","Transposición de válvula venosa, cualquier vena donante",N/C,"296.02"
1022,"34530",Anastomosis venosa safenopoplítea,"214.97","215.69"
1023,"35001","Corrección directa de aneurisma, aneurisma, o Escisión (parcial o total) e Inserción de injerto (con o sin injerto de parche) en arteria carotida o arteria subclavia por aneurisma y enfermedad oclusiva asociada, mediante Incisión en el cuello",N/C,"384.04"
1024,"35021","Corrección directa de aneurisma, aneurisma, o Escisión (parcial o total) e Inserción de injerto (con o sin injerto de parche) en subclavia o arteria innominada por aneurisma, seudoaneurisma y enfermedad oclusiva asociada mediante Incisión torácica",N/C,"374.94"
1026,"35180",Corrección de fístula arteriovenosa congénita en cabeza y cuello,"385.44","385.86"
1027,"35182",Corrección de fístula arteriovenosa congénita en torax y abdomen,"385.44","385.86"
1028,"35184",Reparación de fístula arteriovenosa congénita en extremidades,"281.46","281.75"
1029,"35201",Sutura directa de vaso sanguíneo; cuello,"281.46","281.75"
1025,"35081","Corrección directa de aneurisma, aneurisma, o Escisión (parcial o total) e Inserción de injerto (con o sin injerto de parche) en arteria aortica abdominal por aneurisma, seudoaneurisma y enfermedad oclusiva asociada",N/C,"384.04"
1030,"35216",Sutura directa de vaso sanguíneo intratorácico sin derivación,N/C,"443.64"
1031,"35231","Sutura de vaso sanguíneo con injerto venoso, en cuello","288.33","288.75"
1032,"35241",Reparación de vaso sanguíneo intratorácico con injerto venoso con derivación,N/C,"443.64"
1033,"35301","Tromboendarterectomía incluyendo parche de injerto, si se realizara, de la arteria carotida, vertebral o subclavia mediante Incisión en el cuello",N/C,"286.93"
1034,"35331","Tromboendarterectomía, incluyendo parche de injerto, si se realizara, de arteria aorta abdominal",N/C,"501.21"
1035,"35452",Angioplastía abierta con balón transluminal de arteria aorta,N/C,"399.83"
1036,"35470",Angioplastía con balón transluminal percutánea,N/C,"380.5"
1037,"35480","Aterectomía periférica transluminal, abierta",N/C,"283.85"
1038,"35490","Aterectomía periférica transluminal, percutánea",N/C,"283.85"
1039,"35526",Derivación sanguínea con injerto de vena entre la arteria aorta y la arteria subclavia o la arteria carotida,N/C,"445.47"
1040,"35531",Derivación sanguínea con injerto de vena entre la arteria aorta y la arteria celíaca o entre la arteria aorta y la arteria mesentérica,"399.19","399.87"
1041,"35541",By-pass Aorto - iliaco o biiliaco,"303.81","304"
1042,"35546",By-pass Aorto-femoral o bifemoral,"303.81","304"
1043,"35556",Derivación sanguínea con injerto de vena entre la arteria femoral y la arteria poplitea,"420.16","420.88"
1044,"35691",Transposición y/o reimplante de la arteria vertebral hacia la arteria carotida,"288.33","288.75"
1045,"35700","Reoperación a nivel de arterias femoral- poplítea o femoral (poplítea)-tibial anterior, tibial posterior, peronea, u otros vasos distales más allá de 1 mes posterior a la Operación original (registrar separadamente además del código de procedimiento primario)","173.18","173.79"
1046,"36000",Introducción de aguja o catéter en vena periférica,N/C,"1.37"
1047,"36415",Colección de sangre venosa por venipuntura,N/C,"2.84"
1048,"36416","Coleccion de sangre capilar (p ej dedo, talon u oreja)","1.06","1.06"
1049,"36430",Transfusión de sangre o componentes sanguíneos,"58.78","86.83"
1050,"36450",Exsanguinotransfusion de recién nacido,"61.42","62.13"
1051,"36455","Exsanguinotransfusión de cualquier otro tipo de paciente, excepto recién nacido","107.13","107.13"
1052,"36460",Transfusion fetal intrauterina,"59.88","60.5"
1053,"36470",Inyección de solución esclerosante en una sola vena,"51.75","58.54"
1054,"36481",Catéterizacion percutánea de vena porta mediante cualquier método,"51.75","58.54"
1055,"36488","Colocación percutánea de catéter venoso central (subclavia, yugular, u otra vena) en menor de 2 años de edad","51.58","53.88"
1056,"36489","Colocación de catéter venoso central (p ej para presión venosa central, quimioterapia, otros)",N/C,"54.75"
1057,"36500",Catéterismo venoso para toma selectiva de muestras de sangre de distintos órganos,"51.05","51.27"
1058,"36510",Catéterismo de vena umbilical para diagnóstico o tratamiento en recién nacido,"51.05","51.27"
1059,"36511",Aféresis terapéutica de leucocitos,"25.01","25.76"
1060,"36513",Aféresis terapéutica de plaquetas,"812","812"
1061,"36522",Fotoféresis extracorporea,N/C,"6.38"
1062,"36557","Colocación de catéter venoso central tunelizado insertado centralmente en menor de 5 años de edad, sin bomba de infusión o puerto subcutáneo",N/C,"426.45"
1063,"36565",Colocación de catéter venoso central tunelizado insertado centralmente que requiere 2 catéteres vía 2 sitios venosos de acceso separados sin bomba de infusion o puerto subcutáneo (p. ej. Catéter tipo Tesio),N/C,"426.45"
1064,"36569",Colocación periférica de catéter venoso central (PICC) sin bomba de infusión o puerto subcutáneo en niño de 5 años de edad o mayor,,"1.67"
1065,"36593",Trombólisis de un catéter o dispositivo de acceso vascular implantado mediante un agente trombolítico,N/C,"3016.9"
1066,"36600",Punción arterial para extracción de sangre para diagnóstico,"9.22","9.23"
1067,"36620","Catéterismo o canulación arterial percutánea para toma de muestra, monitorizacion o transfusion (procedimiento separado)","10.29","10.29"
1068,"36660","Catéterismo de arteria umbilical en recién nacido, para diagnóstico o tratamiento","51.49","51.54"
1069,"36821",Anastomosis arteriovenosa abierta directa en cualquier sitio (p ej procedimiento de Cimino) (procedimiento separado),"111.5","111.93"
1070,"36825",Creación de fístula arteriovenosa mediante injerto autólogo que no sea una anastomosis arteriovenosa directa (procedimiento separado),"141.9","142.45"
1071,"36831","Trombectomía abierta de fístula arteriovenosa, sin revisión, injerto autólogo o no autólogo para diálisis (procedimiento separado)","158.11","158.48"
1072,"36834",Corrección plástica de aneurisma arteriovenoso,"304.53","305.08"
1073,"37140",Anastomosis venosa abierta porto-cava,"385.44","385.86"
